{
  "$schema": "http://json-schema.org/draft-07/schema#",
  "$id": "crux://contracts/reading-table.schema.json",
  "title": "Bảng đọc của một kênh — v0",
  "description": "Bảng đọc (mục audio/AU-007) là DỮ LIỆU của kênh: cách chuẩn hoá văn bản trước khi đưa vào TTS (số tiền, phần trăm, viết tắt tài chính…). Cấu trúc trung tính thể loại/kênh nên đứng ở kernel; nội dung (các luật) nằm trong packs/channels/. Mỗi luật là một cặp pattern→replacement kèm MỘT ca kiểm (test) để không luật nào không được kiểm — bộ chuẩn hoá của xưởng audio là chỗ chạy các ca kiểm đó.",
  "type": "object",
  "additionalProperties": false,
  "required": ["channel", "rules"],
  "properties": {
    "$note": { "type": "string" },
    "$source": { "type": "string" },
    "channel": {
      "type": "string",
      "minLength": 1,
      "description": "Slug kênh, phải khớp tên thư mục chứa file — kiểm ở ops/scripts/check-reading-table.ts."
    },
    "rules": {
      "type": "array",
      "minItems": 1,
      "items": {
        "type": "object",
        "additionalProperties": false,
        "required": ["id", "pattern", "replacement", "test"],
        "properties": {
          "id": {
            "type": "string",
            "pattern": "^[a-z0-9][a-z0-9-]*$",
            "description": "Định danh tiếng Anh, duy nhất trong bảng (CLAUDE.md mục 9)."
          },
          "description": { "type": "string" },
          "pattern": {
            "type": "string",
            "minLength": 1,
            "description": "Biểu thức chính quy (cú pháp JavaScript RegExp)."
          },
          "flags": {
            "type": "string",
            "pattern": "^[gimsuy]*$",
            "description": "Cờ RegExp; mặc định 'g' nếu bỏ trống (bộ chuẩn hoá tự thêm)."
          },
          "replacement": {
            "type": "string",
            "description": "Chuỗi thay thế, dùng được $1..$9 như String.prototype.replace."
          },
          "test": {
            "type": "object",
            "additionalProperties": false,
            "required": ["input", "expected"],
            "properties": {
              "input": { "type": "string", "minLength": 1 },
              "expected": { "type": "string" }
            }
          }
        }
      }
    }
  }
}
